[
  { "exp_id": "exp-0401", "title": "Loop closure baseline", "metric": "ATE", "value": 0.061, "unit": "m", "score": 5, "status": "done", "run_on": "2026-09-02", "logged_on": "2026-09-02", "robot_id": "robot-hb1", "dataset_id": "ds-hall-loop", "paper_ids": ["paper-orb3"], "tags": ["slam", "indoor"] },
  { "exp_id": "exp-0402", "title": "IMU bias sweep", "metric": "bias", "value": 0.0031, "unit": "rad/s", "score": 6, "status": "done", "run_on": "2026-09-05", "logged_on": "2026-09-05", "robot_id": "lidar-rig", "dataset_id": "ds-bench-vib", "paper_ids": ["paper-vib-cal"], "tags": ["calibration", "imu"] },
  { "exp_id": "exp-0403", "title": "Hall-loop at 1.2 m/s", "metric": "ATE", "value": 0.048, "unit": "m", "score": 7, "status": "done", "run_on": "2026-09-09", "logged_on": "2026-09-09", "robot_id": "robot-hb1", "dataset_id": "ds-hall-loop", "paper_ids": ["paper-orb3", "paper-lio"], "tags": ["slam", "indoor"] },
  { "exp_id": "exp-0404", "title": "Stairwell attempt", "metric": "ATE", "value": 0.9, "unit": "m", "score": 2, "status": "failed", "run_on": "2026-09-12", "logged_on": "2026-09-12", "robot_id": "robot-hb2", "dataset_id": "ds-stairwell", "paper_ids": ["paper-lio"], "tags": ["slam", "failed"], "notes": "Lost tracking on the second landing; wheel slip." },
  { "exp_id": "exp-0405", "title": "Hall-loop with wheel odometry", "metric": "ATE", "value": 0.042, "unit": "m", "score": 8, "status": "done", "run_on": "2026-09-18", "logged_on": "2026-09-19", "robot_id": "robot-hb1", "dataset_id": "ds-hall-loop", "paper_ids": ["paper-orb3", "paper-kalman"], "tags": ["slam", "indoor", "sensor-fusion"] },
  { "exp_id": "exp-0406", "title": "Vibration table calibration check", "metric": "drift", "value": 0.0007, "unit": "rad/s", "score": 7, "status": "done", "run_on": "2026-09-22", "logged_on": "2026-09-22", "robot_id": "lidar-rig", "dataset_id": "ds-bench-vib", "paper_ids": ["paper-vib-cal"], "tags": ["vibration", "calibration"] }
]
